row_id,content,theme,sentiment_word,sentiment_anls
4007,东西没要 商家诚信度差 赠品要收400多运费  来来回回打了四五个电话 一会说不便宜我申请退货，一会又说运费给便宜，我说不要了，又打电话说运费给免了，我考虑凑合要了吧，又打电话说赠品尺寸没那么大了，给个小的吧，我说我不要了真不要了，又打电话说和别的客户换了个尺寸，以为人都傻吗，我都怕了，水很深，我可不敢买了，售后不定多差呢，幸好退货了，可不贪便宜了。,诚信度;NULL;NULL;,差;不便宜;很深;,-1;-1;-1;
4008,马蛋的， 我还没收到东西。 你系统都能标识我收货了， 什么***，,,,
4009,我真不知道是苏宁运输的问题还是华帝质量的问题，烟机右边表面凹陷，打电话给华帝客服说钱给谁了找谁？上门安装什么玩意不懂，尺寸弄错了，把我墙打两个洞连声道歉都没有，要试一下烟机还说外表正常就没问题，我真TM醉了。,NULL;NULL;NULL;,凹陷;没问题;醉了;,-1;1;-1;
4010,说实话不是看在机器凑合，真的一颗心不想给，客服每个月薪一百元吗？服务态度烂的要死，发消息两天不回，回了游戏不能玩说让我找官网？我zhao ni ma！,NULL;服务态度;,凑合;烂;,0;-1;
4011,白色后壳上有块脏东西，虽然不大但是看起来很闹心，最关键的是还擦不掉！反应给客服，拍了半天照片客服一直告诉我看不到，我也是醉了！！对客服的眼神表示同情！,看起来;NULL;,闹心;醉了;,-1;-1;
4012,一般般吧，没多少泡沫,NULL;,一般般;,0;
4013,电视不怎么样，一分钱一分货，买好点的吧。电视有个坏点，右上角非边缘区域，一眼就能看到，售后3个坏点才给换。屏幕看我图片吧，失望。,电视;NULL;,不怎么样;失望;,-1;-1;
4014,壶盖变形，一边高，一边低，看起来工艺不好，水还是能煮开的。苏宁真是越搞越差了，以后买大件要谨慎三思，百几十块钱的东西到是可以。,壶盖;NULL;NULL;工艺;,变形;高;低;不好;,-1;-1;-1;-1;
4015,收到货了，物流好快哦,物流;,好快;,1;
4016,速度很慢。打开程序要等半天，物流也超慢。总之很失望,速度;物流;NULL;,很慢;超慢;失望;,-1;-1;-1;
4017,物美价廉，性价比高，使用正常。,NULL;性价比;使用;,物美价廉;高;正常;,1;1;1;
4018,款式设计时尚，制冷效果很好，价格性价比高,设计;制冷效果;性价比;,时尚;很好;高;,1;1;1;
4019,外观漂亮烧水很快,外观;烧水;,漂亮;很快;,1;1;
4020,这客服我服了[追评]果断不用，扔了,,,
4021,舒肤佳用了皮肤好！！,皮肤;,好;,1;
4022,还没开始用，产品外观看上去还不错，就是没有存放鸡蛋的位置，还有中间隔层的玻璃两侧没有包裹塑料的保护套，个人觉得容易磕坏，其他暂时没有不足，用过之后再评价,看上去;觉得;,不错;磕坏;,1;-1;
4023,这是最窝火的一次购物！货物的质量我们先不说，预约了两次安装，400非说没有预约记录！安装师傅都到我现场了！400还是那么说！还有售后安装只会连接口子的接口，如果要改动水管的话是没法做的！联系土豪朋友可以购买，如果觉得心情好，需要刺激，想发火的朋友也可以购买！,购物;心情;,窝火;好;,-1;1;
4024,有点痛心 一周 就掉漆啦 很难受伤心,NULL;NULL;,痛心;掉漆;,-1;-1;
4025,放在餐厅噪音比较大，特别晚上哼哼的声音受不了，以前用的冰箱没有这么大声音，售后上门看了说正常，没办法，忍受吧,噪音;声音;,较大;受不了;,-1;-1;
4026,想象中的完美，蓝牙很稳定,NULL;蓝牙;,完美;稳定;,1;1;
4027,冰箱收到了，被磕到了，因为急用，懒的换了。,,,
4028,没有贴膜，没有保护套，运行速度一般，比手机慢好多,运行速度;NULL;,一般;慢;,0;-1;
4029,还不错，合作愉快,NULL;NULL;,不错;愉快;,1;1;
4030,根本就没有发货！问了好几天才跟我说！太差,NULL;,太差;,-1;
4031,这个艾美特电风扇很好，我已经买了三个才送你。,NULL;,很好;,1;
4032,后面两个高低音调大的，没有任何作用，高低音调来调去都是一样，有点怀疑是假货。,NULL;,假货;,-1;
4033,一般，这个价位也是合理的,NULL;价位;,一般;合理;,0;1;
4034,將就,,,
4035,看起来很不错，暂时没用上,看起来;,不错;,1;
4036,感觉电量不太耐用，别的都还好,NULL;,还好;,1;
4037,优禄手表外表做工精致，也很美观，就是测量血压时收缩压比欧姆龙血压仪低了20mmhg，这对我这个多年高血压病患者，失去了及时监测血压的作用。我要求换测量血压较准的手表。,做工;NULL;,精致;美观;,1;1;
4038,数据线太***，很细看起来都有点危险，而且充上电手机一直闪(一会充得起一会充不起)。充电头子初次使用暂时未发现问题。将个就了吧。,NULL;,危险;,-1;
4039,倒是挺实惠，就是和我以前有用的不一样，不知道是换了还是不是正品,NULL;,实惠;,1;
4040,非常好，专业品质，除菌保鲜冰箱，不需要保鲜膜的冰箱，健康冰箱，效果杠杠的,NULL;品质;效果;,好;专业;杠杠的;,1;1;1;
4041,挺好的，除了有些衣服洗的不够干净,NULL;洗;,挺好;不够干净;,1;-1;
4042,挺好用的，吸收不错，贴合也不错。味道淡淡的很好闻。水水的，没有不适感。精华也很多。卖家的包装不错。用完了再来买。,NULL;吸收;NULL;味道;NULL;包装;,挺好用;不错;不错;淡淡的;好闻;不错;,1;1;1;1;1;1;
4043,送货很快，2个师傅一起抬到5楼的，很是辛苦。安装第二天就到，很认真的教我怎么使用新机器。洗衣机很节水，运行时静音效果不错。整体很满意。希望能使用时间能很久。,送货;NULL;NULL;洗衣机;效果;整体;,很快;辛苦;认真;节水;不错;满意;,1;1;1;1;1;1;
4044,不知道是不是正品，味道是我用很多瓶最怪的味道,,,
4045,申通发过来的，没包装，没封口，不知道真假,,,
4046,各方面都不错的，小孩子高兴的很，这么便宜的价格买这么好的电视，wifi接受很好，信号不是很好的也可以看得到电视。,各方面;NULL;价格;接受;信号;,不错;高兴;便宜;很好;不是很好;,1;1;1;1;-1;
4047,质量差，灵敏度差,质量;灵敏度;,差;差;,-1;-1;
4048,真的很一般，去了塑料感十足。,NULL;塑料感;,一般;十足;,0;1;
4049,重量还可以，但电量少，不耐用,重量;电量;NULL;,还可以;少;不耐用;,1;-1;-1;
4050,感觉画质不好，而且玩游戏一点都不流畅。但是卖家的服务还行，快递也很快。,画质;玩游戏;服务;快递;,不好;不流畅;还行;很快;,-1;-1;1;1;
4051,续航不怎么样，放了一晚上没动，剩下70%～,续航;,不怎么样;,-1;
4052,师傅工作很专业认真，这是我第二次使用贵公司产品，产品一如既往的好，值得信赖！,工作;NULL;NULL;产品;NULL;,专业;认真;贵;好;值得信赖;,1;1;-1;1;1;
4053,感觉冰箱门封没有我家原来用的西门子紧密，联系了售后检查一下看情况。,,,
4054,音质不好，高音有破响，线控也有问题[追评]线控不暂停播放，麦克风说话没声音，高音破声,音质;高音;线控;高音;,不好;破响;有问题;破声;,-1;-1;-1;-1;
4055,收到货了，只是没有充电线，有***的感觉。,,,
4056,东西一般，不知道使用情况怎么样，有待验证。,东西;,一般;,0;
4057,客服没人，还要我亲子打电话过去才给我发货，等了很久才收到，不得不给差评了。,NULL;,差评;,-1;
4058,一起买的鼠标是坏的，指示灯不亮，客服居然说鼠标指示灯本来就不亮，绝对差评，[追评]这个评价发错地方了,鼠标;指示灯;NULL;NULL;,坏;不亮;不亮;差评;,-1;-1;-1;-1;
4059,很不错的一次购物,购物;,不错;,1;
4060,不好，才发现会掉漆，手一碰就掉了,NULL;NULL;NULL;,不好;掉漆;掉了;,-1;-1;-1;
4061,自己的管理页面都刷不出来～我这百兆宽带，测速经常20多，30多～你这叫我怎么忍??,,,
4062,虽说华为荣耀一家亲，可你打出的是华为，为什么发来的是荣耀的？！除了这一点，别的没的说，线比较柔软且细，精致金属外观，对得起这价位,NULL;线;NULL;价位;,没的说;柔软;精致;对得起;,1;1;1;1;
4063,物流好差，包装严重挤压变形，产品没有外包装,物流;包装;挤压;,好差;严重;变形;,-1;-1;-1;
4064,非常非常不错的UV镜，电话查询是正品，相信苏宁易购，非常满意,NULL;NULL;NULL;,不错;正品;满意;,1;1;1;
4065,伴侣发错货导致二次安装，还没担当，苏宁袒护自营店，太失望，无力再吐槽，最后一单，永不再用苏宁购物。,NULL;NULL;,错货;失望;,-1;-1;
4066,质量很好，苏泊尔大品牌值值得信赖，苏宁5年前我就办了会员卡，相信苏宁易购，相信我自已,质量;大品牌值;,很好;值得信赖;,1;1;
4067,新房里买的，我觉得很好，很实用，有半胆全胆，节能模式等，时时处处都有热水用，也不用担心太耗电了（以前用的那个热水器特耗电）！按键也很灵敏！很喜欢,觉得;NULL;按键;NULL;,很好;实用;灵敏;喜欢;,1;1;1;1;
4068,走不到1000公里声音和拖拉机一样,,,
4069,太重了，车跑起来后记录仪抖得很厉害,NULL;NULL;,太重;厉害;,-1;1;
4070,8.18去苏宁青岛香江路店选的，冰箱很不错，很满意。也辛苦两位师傅帮忙搬到楼上。这次购物很满意，一如既往地支持苏宁！！！,冰箱;NULL;NULL;购物;苏宁;,不错;满意;辛苦;满意;支持;,1;1;1;1;1;
4071,不好，还得打眼，也没说清楚,NULL;,不好;,-1;
4072,和之前充电器一样 也没觉得有什么质量问题 反正还挺好的,NULL;,挺好;,1;
4073,蛮不错，好,NULL;NULL;,不错;好;,1;1;
4074,还没用，还可以吧，但愿好用,NULL;NULL;,还可以;好用;,1;1;
4075,好胡便宜实用。,NULL;,实用;,1;
4076,还没有使用没有发言权，好小的一瓶就35ml，包装倒是不错，严严实实的，有零度以下的地区慎买，可能会结冰。,NULL;包装;NULL;,好小;不错;严严实实;,-1;1;1;
4077,给丫头买的，图片上这个功能到现在也没弄明白是什么，客服半天回一句，告诉我是气压，说还要去问售后。第一次网购给差评。,网购;,差评;,-1;
4078,还是好烫,NULL;,好烫;,-1;
4079,耳机外型好看，音质不那么好，快递直接给我整了十多天才到，商家也不进行催催，给商家联系不回信息。,外型;,好看;,1;
4080,线很长，颜色也很好看,线;颜色;,很长;好看;,-1;1;
4081,刚到没有电，在充电不知道怎么样。还是和图片上有区别。感觉做的不是很精细。,,,
4082,烟机下午收到！晚上加班按的！做工非常的好，价格优惠大，抽风大而静音，物流也很给力，外观高贵而漂亮，性价比非常高，非常满意，客服热情周到，特别是售后明日的服务。有问必答，赞了，相信品牌的力量!,做工;价格;抽风;物流;外观;NULL;性价比;NULL;客服;NULL;,好;优惠;静音;给力;高贵;漂亮;高;满意;热情周到;赞;,1;1;1;1;1;1;1;1;1;1;
4083,卖家服务态度好评，因为是送人的，所以收到货的时候箱子被快递给弄破了没法送人了，然后就反馈给了店家，店家第一时间给我处理了，给我重新换货了，质量的话因为不是我自己在用所以没法说，但是我朋友说用的很不错，很好，,服务态度;NULL;NULL;NULL;,好评;破;不错;很好;,1;-1;1;1;
4084,还行吧，感觉是一大包，会掉毛毛的，摩擦脸部有点硬和扎脸,NULL;脸部;,还行;有点硬;,1;-1;
4085,建议买带固态硬盘的，不然会卡出翔！,,,
4086,送个保护膜都送个不对型号的，送的套被刮了。心情不阳光,NULL;,不对;,-1;
4087,去不了死皮，没用,,,
4088,真心不好用，一点都不上色；只能当眉笔,NULL;,不好用;,-1;
4089,续航能力低，离开3米左右声音断续，卡顿，断音,续航能力;NULL;,低;卡顿;,-1;-1;
4090,商品不怎么好,商品;,不怎么好;,-1;
4091,说好的一送二，啥都没有，清洗的刷子都不带！,,,
4092,还行，就是薄了些,NULL;NULL;,还行;薄;,1;-1;
4093,书还可以，学习下心理学,书;,还可以;,1;
4094,拿到手就迫不及待的试了一下，非常顺滑舒适，刮得干干净净不错！,NULL;NULL;刮得;,顺滑;舒适;干干净净;,1;1;1;
4095,物差价高，什么东西，下次我一定再不来了。,NULL;,高;,1;
4096,物流比较快，提前一天送到，安装师傅比较专业，很快就装好了。,物流;安装师傅;NULL;,较快;专业;很快;,1;1;1;
4097,还是以前的旧货，卖了很久了，商家一直没更新，不能给好评！,NULL;,很久;,-1;
4098,完全货不对版？差评,NULL;NULL;,不对版;差评;,-1;-1;
4099,还是挺好吃的，只是没有配带剥皮器，手包不是很方便,NULL;,挺好吃;,1;
4100,物流挺快，转天就到了。盒子小巧。功能太差，本地台根本看不了，没有信号源。电影和电视剧几乎都是收费的，根本看不了，价格本身不便宜，也不赠送一下会员，没有亮点。,物流;盒子;功能;NULL;价格;,挺快;小巧;太差;看不了;不便宜;,1;1;-1;-1;-1;
4101,当时是因为急着要用联系的卖家说第二天能到货所以购买的，没想到买到自己手上半个月不到的时间屏稀碎的，然而膜还是好好的，只是急着用没办法也是涂便宜，因为东西一直在小孩那里所以具体什么原因损坏我们也不清楚后续维修费用我们也愿意自行承担，但是售后的态度真的不咋地，所以奉劝各位买这种电子产品还是上实体店靠谱！,NULL;态度;实体店;,稀碎;不咋地;靠谱;,-1;-1;1;
4102,给婆婆买的，据说不错，京东快递就是快,NULL;NULL;NULL;,不错;快;快;,1;1;1;
4103,差评，少给一个22P的瓷片电容，快递还给我送错学校！差评没商量,NULL;NULL;,差评;差评;,-1;-1;
4104,质量不错，感觉还好,质量;NULL;,不错;还好;,1;1;
4105,绝对差评，从没在网上买东西出过这种情况，本想买回来自己组装的，结果这个有问题那个有问题，来回退换了几次都没解决，现在时间都过了也不能退换了，依然没解决&hellip;以后再也不在京东买东西了，倒霉！！！,NULL;结果;NULL;NULL;,差评;有问题;有问题;倒霉;,-1;-1;-1;-1;
4106,安装很好，不错,安装;NULL;,很好;不错;,1;1;
4107,还未使用,,,
4108,分量大，三口人吃两顿，就是酱不够用了,分量;酱;,大;不够用;,1;-1;
4109,一分价钱一分货吧，到现在还没有用，拿出来摸手感还凑合,手感;,凑合;,0;
4110,一点都不好用，烧得又慢，声音非常大。而且打出来的豆浆很粗很多渣，还不如之前199元的，劝各位别买这款,NULL;NULL;声音;NULL;,不好用;慢;大;渣;,-1;-1;-1;-1;
4111,这本书还不错，小孩子玩看得很开心,书;NULL;,不错;开心;,1;1;
4112,买了备用的。,,,
4113,买回来还没有用，应该还可以吧。,NULL;,还可以;,1;
4114,这店太黑了，才十来天就降价差不多就少40元，京东在走下坡路了，真坑人,NULL;,太黑;,-1;
4115,手感很好 跟手机很搭 磨砂的 好评,手感;NULL;,很好;好评;,1;1;
4116,抢购也不是很实惠，买了之后还没用。,,,
4117,一般般！,NULL;,一般般;,0;
4118,京东商城的东西是物美价廉的   比实体店便宜好多呢 而且配送很周到  送到家,东西;NULL;配送;,物美价廉;便宜;周到;,1;1;1;
4119,厚厚一层灰，这是放了多久。京东仓库也太脏了吧,NULL;,太脏;,-1;
4120,声音好大，感觉快散架了，但愿机长久，千里共开心。,声音;NULL;,好大;开心;,-1;1;
4121,第一次买,,,
4122,一般般不怎麼樣,NULL;,一般般;,0;
4123,贝亲也是大品牌，收到货打开包装一看盖子是坏的，还很薄，大厂家的包装不过关，里面的产品不知道怎么样，想退太麻烦了，售后服务比较到位，还有京东的快递还是一流的快,盖子;NULL;NULL;NULL;售后服务;快递;NULL;,坏;很薄;不过关;麻烦;到位;一流;快;,-1;-1;-1;-1;1;1;1;
4124,usbc口有问题，插不到手机上，不知道里面哪卡着，这么便宜的东西换也麻烦，凑合用另外的口吧,NULL;NULL;东西;,有问题;便宜;麻烦;,-1;1;-1;
4125,纸挺好的～很划算啊&hellip;&hellip;就是没有包装直接只有纸发过来了？？？？？,纸;NULL;,挺好;划算;,1;1;
4126,值得品尝。,NULL;,值得品尝;,1;
4127,办公室里用用，蛮好的。,NULL;,蛮好;,1;
4128,没有像上面说的一颗都没换，一袋还没吃完就坏了两颗，整体感觉还好吧！味道还行！20块有40粒，还是挺划算的，比在超市买的便宜，超市买的也有很多坏的！,NULL;味道;NULL;NULL;NULL;,还好;还行;划算;便宜;坏;,1;1;1;1;-1;
4129,保温很好，倒入开水后，杯子外面一点也不热。,保温;NULL;,很好;不热;,1;-1;
4130,质量不错，感觉挺好的,质量;NULL;,不错;挺好;,1;1;
4131,保温效果不是特别好,,,
4132,刚买就降价50还有一张100的券死活不让保价,,,
4133,只想给负分。之前买的都还可以，可这次，差到爆，看图，深色是这次的，真是呵呵了，再也不会买了,NULL;NULL;NULL;,负分;还可以;差;,-1;1;-1;
4134,很好吃，一会就吃了一大半，宝宝们说不够吃,NULL;,很好;,1;
4135,还不错，好用。,NULL;NULL;,不错;好用;,1;1;
4136,今天贴膜，发现圆圈旁边的是松的，就是后面相接前面中间的地方，都是松的，买锤子，我骗人，全家死绝。,NULL;,骗人;,-1;
4137,感觉没几把用,,,
4138,比科尔沁的好一点，但是这切割也是醉了，日期20170904,NULL;NULL;,好;醉了;,1;-1;
4139,*，什么鬼！居然漏尿！！！根本就不导流全团在前面一坨，前面都涨到不行了后面一点尿都没有。还有反渗，宝贝屁屁那是湿的！卖的什么鬼东西，跟bubugo一样差！对比我在别处买的好奇便宜**左右，结果贪便宜我后面还在这买了三箱***肠子都悔青了。现在那三箱还没送到，退不了货就只能全差评。很少给差评，只要将就能用我绝对不会气成这样,NULL;NULL;NULL;NULL;NULL;,漏;鬼东西;差;差评;将就;,-1;-1;-1;-1;-1;
4140,奶粉摸起来好粗糙，也不知道是真是假！,NULL;NULL;,好;粗糙;,1;-1;
4141,大家都推荐，买来试试。,NULL;,推荐;,1;
4142,砧板很好，包装不行。,砧板;包装;,很好;不行;,1;-1;
4143,外观没什么问题，里面的贴纸都翘着没贴住，还不干净，密码位置感觉像旧的,NULL;位置;,不干净;旧;,-1;-1;
4144,一点用都没有，还是有麻木感。喷上后会有轻微灼痛感。感觉买到假货了。也是提前20分钟按照说明去弄得。,NULL;感觉;,麻木;假货;,-1;-1;
4145,非常不错，很好,NULL;NULL;,不错;很好;,1;1;
4146,机器和试纸不错，价格便宜实用。,试纸;价格;NULL;,不错;便宜;实用;,1;1;1;
4147,辣的一匹,,,
4148,还不错，感觉不粘锅有点大，炒菜费油，哈哈,NULL;NULL;,不错;有点大;,1;-1;
4149,价格很实惠，期待不错的口感。,价格;口感;,实惠;不错;,1;1;
4150,不满意，包装不行洗发水倒出来了,NULL;包装;,不满意;不行;,-1;-1;
4151,发的中通快递，不送到位，竟然叫我自提,,,
4152,物流速度快，价格实惠，效果不错,物流速度;价格;效果;,快;实惠;不错;,1;1;1;
4153,便宜好用，足够喝两个月了，奶味也不差,NULL;NULL;奶味;,便宜;好用;不差;,1;1;1;
4154,味道不错，就是油大了点，如果能再辣些，油再少点就完美了,味道;NULL;,不错;油大;,1;-1;
4155,方便，安全,NULL;NULL;,方便;安全;,1;1;
4156,价格实惠，日期新鲜，味道很好喝，省的去超市了，方便，送货及时,价格;NULL;味道;NULL;送货;,实惠;新鲜;好喝;方便;及时;,1;1;1;1;1;
4157,还可以，包装方便，用起来很方便,NULL;包装;用起来;,还可以;方便;方便;,1;1;1;
4158,商品不错，性价比很高，快递员服务很好，送货速度很快,商品;性价比;服务;送货速度;,不错;很高;很好;很快;,1;1;1;1;
4159,还可以，老妈说,NULL;,还可以;,1;
4160,还没吃,,,
4161,第一次在网上购买卫生巾，我就要精彩不停、,,,
4162,一般般。。。。。，，，，，，，不做评价,NULL;,一般般;,0;
4163,显示器很好，很满意，给三星的原因是头一天价格1599，预告第二天秒杀抢购，第二天秒杀还是1599，京东是在逗我么。,显示器;NULL;,很好;满意;,1;1;
4164,东西不错，刚开始用，挂钥匙扣上方便,东西;NULL;,不错;方便;,1;1;
4165,不错，京东新出的品种还用了效果还不错,NULL;效果;,不错;不错;,1;1;
4166,好吃很辣，不過量少了點。,,,
4167,质量可以，就是当时天气太热，刚拿出来放一天，第二天就软趴趴的了,质量;NULL;,可以;太热;,1;-1;
4168,没有上次买的天马的扎实，这个有味道！,NULL;,有味道;,-1;
4169,真的很不错 谢谢咯 支持京东的 一直都在京东买,NULL;,不错;,1;
4170,一般吧东西很多，但是不是自己喜欢吃的。,东西;,一般;,0;
4171,老爸，老妈都说可以,NULL;,可以;,1;
4172,味道不错，口感很好,味道;口感;,不错;很好;,1;1;
4173,还没用 我的是vga的线 这个是hdml的接口 很尴尬  还要买根线,NULL;,尴尬;,-1;
4174,东西看起来很是不错呢，朋友介绍过来的噢,看起来;,不错;,1;
4175,居然是六月九号的！还有一个月过期了！怎么吃的完！,NULL;,过期;,-1;
4176,悔不该贪图便宜，质量很糟糕，不会使用，，直接扔了。。。。,质量;,很糟;,-1;
4177,好吃好味,NULL;,好吃;,1;
4178,品质很好 冬天很舒服吧,品质;NULL;,很好;舒服;,1;1;
4179,没有宣传那么牛B，虽然比日料店的好喝不少,NULL;NULL;,好喝;不少;,1;1;
4180,挺好的东西值得购买！！！,NULL;东西;,挺好;值得购买;,1;1;
4181,箱子上都是灰尘，里面瓶体上也有污点，好像拆开重装过，味道淡淡的，慎重购买！,味道;NULL;,淡淡的;慎重;,1;-1;
4182,好几次购买了，小猫吃着还行。,吃着;,还行;,1;
4183,用了再回来评估,,,
4184,不是第一次买这个果汁，味道好，价格低！,味道;价格;,好;低;,1;1;
4185,贴是挺好贴的，但是太脆弱了，半个月就裂了，给客服留言几天也没人回。没磕着什么也不知道怎么就裂了,NULL;NULL;NULL;,挺好;脆弱;裂;,1;-1;-1;
4186,实物如图，味道淡，洁面乳不是满瓶，送的赠品就是那两个小粉红袋装的睡眠面膜，快递客服都很好，谢谢！,味道;快递客服;,淡;很好;,-1;1;
4187,给孩子用的，香味像西米露,,,
4188,有些涩，不是很甜，有些失望。,NULL;NULL;,涩;失望;,-1;-1;
4189,先屯了,,,
4190,这个口感真的一般，添加剂的味道明显，不会第二次购买,口感;,一般;,0;
4191,购买半个月降价260元，京东的价格很是无语，联系客服也不肯退差价。京东的价格太虚了！,价格;价格;,无语;太虚;,-1;-1;
4192,键盘的纸盒有点旧，破损，纸盒上的防伪码已经部分脱落，感觉不是全新的一样，拿出键盘来看没什么问题，拿完键盘后发现手上有好些灰尘，这是不爽的地方，为什么会这么旧啊,纸盒;NULL;NULL;NULL;NULL;,有点旧;破损;脱落;不爽;旧;,-1;-1;-1;-1;-1;
4193,要的黑色，到的灰色！！！,,,
4194,信赖京东，首选京东。质量品质均有保证。产品质量过硬，办公产品首选。,京东;品质;产品质量;,信赖;保证;过硬;,1;1;1;
4195,买过来试一试看看好不好，后面再说,,,
4196,串珠都有黑点，差评，客服还没有回应,NULL;,差评;,-1;
4197,公司办公用品集中采购，这品牌挺好一直在用。,品牌;,挺好;,1;
4198,没怎么发好，不知道为啥,,,
4199,活动买的 好多好划算 是正品 很好用,NULL;NULL;NULL;,划算;正品;好用;,1;1;1;
4200,马桶盖一点也不好，太松了，怀疑不是配套的吧，由于太大不愿意退货了！不是很新，有点旧！,马桶盖;NULL;NULL;NULL;,不好;太松;不是很新;有点旧;,-1;-1;-1;-1;
4201,一盒分三天吃，每次吃几根，零食不敢给小孩子放开吃,,,
4202,质量不是很好，不知能用多久？,质量;,不是很好;,-1;
4203,第一次买这个品牌的食品，感觉包装各方面都好，味道也不错。,各方面;味道;,好;不错;,1;1;
4204,这个机油真是假的可以，京东自营也出假货，而且假的这么离谱，打开包装倒出的来的机油跟水一样。。以后再也不敢买了,机油;京东自营;NULL;NULL;,假;假货;假;离谱;,-1;-1;-1;-1;
4205,一号下单  今天四号 说的价保 2699买的时候不能用优惠券买了可以用优惠券再减150  还特意加运费晚上送到结果第二天晚上才到   很差的一次购物体验  京东的价保也不行 机子也是去年的库存机  手机像素不怎么样还没步步高 oppo的好 准备退了,NULL;价保;像素;,很差;不行;不怎么样;,-1;-1;-1;
4206,还行，就是用前要放点水有点麻烦,NULL;NULL;,还行;麻烦;,1;-1;
4207,外观很漂亮 数据升级也很快 就是价格下降的也快 。满以为过十一时候买的时候离价格是339元优惠价 现在不到一个月更优惠就降到279元了，问店家没反应，问京东让价格保护还不通过，只能建议大家购买东西时多关注价格走势  尽量在双十一、双十二之类大日子购买了,外观;数据升级;价格;店家;,漂亮;很快;快;没反应;,1;1;1;-1;
