row_id,content,theme,sentiment_word,sentiment_anls
1279,还没有开始用，很不开心的事情就是，为什么面膜有一个没包装好有瑕疵！影响心情&hellip;&hellip;,NULL;NULL;,不开心;瑕疵;,-1;-1;
1280,才用几天就漏油了，弄得衣服上到处都是,NULL;,漏油;,-1;
1281,多次购买，非常不错，好吃?,NULL;NULL;,不错;好吃;,1;1;
1282,看活动囤货来的，4斤装8块钱，这价格应该是可以了。,价格;,可以;,1;
1283,目前没问题,NULL;,没问题;,1;
1284,箱子已经开开了，不是太满意,,,
1285,底板不是竹子的，材质不好，做工也不好?,材质;做工;,不好;不好;,-1;-1;
1286,卡是用过的激活不了。没有耳塞,,,
1287,比超市买划算,NULL;,划算;,1;
1288,特价买的很便宜,NULL;,便宜;,1;
1289,手机还没到，扣先到了，等手机中...,,,
1290,很好很给力，不给差评就默认好评拿京豆~~~~~~,NULL;NULL;,很好;给力;,1;1;
1291,就那样，很一般。下次不会再买这种低端产品了  。试一试罗技高端或者其他品牌。,NULL;NULL;,就那样;一般;,0;0;
1292,一起买的主板是二手的，申请个退换还各种推脱，就是不愿意换，想把责任推到客户身上。京东的售后服务真的是越来越**了。申请售后一天都不给处理。,主板;退换;,二手;推脱;,-1;-1;
1293,还可以 主要是送货超级快,NULL;送货;,还可以;快;,1;1;
1294,机子不错，和我其他美的电器配合起来，看上去还算高档,机子;看上去;,不错;高档;,1;1;
1295,"还可以吧,用了两次了",NULL;,还可以;,1;
1296,不好，不甜，不如在超市买的，购买失败，价格贵,NULL;购买;价格;,不好;失败;贵;,-1;-1;-1;
1297,嗯这个香味还是不错的，哦,香味;,不错;,1;
1298,这牛奶也要稍微包一下吧，收到货都成这样，希望日后能改善下包装方面，,,,
1299,很多很多,,,
1300,没太大感觉！,,,
1301,用着还不错，就是那个耳罩有点小,用着;耳罩;,不错;小;,1;-1;
1302,好少哦，一个大盒子,NULL;,好少;,-1;
1303,第一次发的货包装破烂，锅的表面各种划伤和磕碰掉漆，要求换货第二次的才没什么问题，对于促销就发问题商品的行为严重鄙视！提醒其他消费者，若发现这种行为一定要维护自己的权力，不要忍让，不要怕麻烦！否则无良商家就得逞了！,包装;NULL;NULL;NULL;商家;,破烂;划伤;掉漆;鄙视;无良;,-1;-1;-1;-1;-1;
1304,物流超快 昨晚拍的 今中午到了,物流;,超快;,1;
1305,烧菜功能怎么久坏了，无语,功能;NULL;,坏;无语;,-1;-1;
1306,有点太大了吧？？？感觉不怎么亮?,NULL;,太大;,-1;
1307,包装挺好，味道不错，,包装;味道;,挺好;不错;,1;1;
1308,被坑了，被坑了，被坑了，被坑了，被坑了，被坑了，被坑了，被坑了，被坑了，被坑了，一颗星都不想给的，,NULL;NULL;NULL;NULL;NULL;NULL;NULL;NULL;NULL;NULL;,坑;坑;坑;坑;坑;坑;坑;坑;坑;坑;,-1;-1;-1;-1;-1;-1;-1;-1;-1;-1;
1309,不想说这壳有多烂，装都装不进去,壳;,烂;,-1;
1310,质量不错，功能挺多,质量;功能;,不错;挺多;,1;1;
1311,味道不错，价格吗就这样了。,味道;NULL;,不错;就这样;,1;0;
1312,三包里面有一包倒出了一片塑料片&hellip;&hellip;,,,
1313,感觉不错，就是量少点,NULL;NULL;,不错;量少;,1;-1;
1314,回来的时候有好大的味道。然后开水煮了几遍，声音有点大，其他还好,味道;声音;NULL;,好大;有点大;还好;,-1;-1;1;
1315,还不错就是有个缺点，可能低于5斤的东西称不到.,NULL;,不错;,1;
1316,这么样我是个体经济体制内容颜,NULL;,经济;,1;
1317,掉毛，不方便操作手机，得摘下来。,操作手机;,不方便;,-1;
1318,**，就几块德芙也敢标价九十多，看着也廉价，不适合送人，谁送谁～,看着;NULL;,廉价;不适合;,1;-1;
1319,味道太大了，面料太差,味道;面料;,太大;太差;,-1;-1;
1320,水果味道，香香的，用起来。,,,
1321,还没有开始使用，但是那个开关太不给力。还没用上面的防水罩就套不牢了，总是会掉下来。希望浴霸不要再那么不给力。,开关;防水罩;,不给力;不牢;,-1;-1;
1322,我不想说京东怎么把关的，质量这么差，直接是残次品。这质量.....。没用京东快递，用的韵达，而且代收没有任何消息，我很困惑，京东超市发货用韵达吗？我懒得折腾，自己补了，这怎么信任....,质量;NULL;NULL;,差;残次品;折腾;,-1;-1;-1;
1323,价格便宜，味道一般，看个人,价格;味道;,便宜;一般;,1;0;
1324,还行，就是有点大块了,NULL;,还行;,1;
1325,做活动买的，性价比好。,性价比;,好;,1;
1326,仅仅是试试看的态度。因为捂的时间有点久吧，肚皮上有红点。比较痒,NULL;,较痒;,-1;
1327,垃111级货，20元的都不如,,,
1328,不好用，不保温，对不起这个价格，每次喝水都要再烧一次,NULL;,不好用;,-1;
1329,和网上的区别很大，，根本就看不清楚，,区别;NULL;,很大;看不清楚;,1;-1;
1330,刚下单发现颜色点错了马上跟客服联系，客服好半天回一句官方话，再接着跟他说要求发货时换一个颜色，就没有回复，如此反复的拖了几小时。后来终于有正常回复的话语，但是死活不换，一直说下单什么颜色就发什么颜色。这种服务和态度真不敢恭维。,态度;,不敢恭维;,-1;
1331,不错，买给别人用的，据说热水量不太够,NULL;,不错;,1;
1332,买了五袋米，其中一袋不是真空包装，而且有一个非常大的洞，回到家就散了一地，差评！,NULL;,差评;,-1;
1333,京东还需要评价？,,,
1334,不好用，声音很大，,NULL;声音;,不好用;很大;,-1;1;
1335,应该不差！买回来还没用呢&hellip;&hellip;,NULL;,不差;,1;
1336,商品坏了，不会响，给朋友买的生日礼物，好尴尬,商品;NULL;NULL;,坏;不会响;尴尬;,-1;1;-1;
1337,说实话，有点失望，物流慢了一天，而且这绷带没弹性,NULL;物流;,失望;慢;,-1;-1;
1338,这个价位，还不错。,NULL;,不错;,1;
1339,造型很Q，很可爱的，保温能力一般般，总的来说三四十块钱这价格是值的。,造型;能力;,可爱;一般般;,1;0;
1340,刚拿到手里试听，有种想退货的冲动。听音效完全就像在听单声道的音箱。不过用过两天后，确实有评论里说的不闷头的体会。,,,
1341,方便面用塑料袋送货，都碎啦,NULL;,碎;,-1;
1342,不满意。。。,NULL;,不满意;,-1;
1343,东西一般吧！没什么优点,东西;,一般;,0;
1344,味道不好，不知道加了什么，吃完嘴里麻了，长口疮，腮帮子都肿了。,味道;帮子;,不好;肿;,-1;-1;
1345,这个赠品接头没有收到，没有给我,,,
1346,一直信赖京东的产品，快捷方便，有品质,NULL;产品;NULL;,信赖;快捷;方便;,1;1;1;
1347,说是去湿的，我觉的没有什么效果,,,
1348,口感一般般，价格偏高。,口感;价格;,一般般;偏高;,0;-1;
1349,首先要说的是，快递实在慢的不行，我本以为昨天中午就该到了，结果今天晚上才给我打电话，六块运费白交了？？？其次u盘卡槽里边有明显的刮痕。。我试了试显示总共29G，心想反正都是这也差不多。。能用就行。。。。。反正以后也不会再买了,快递;NULL;NULL;,慢;不行;差不多;,-1;-1;0;
1350,充电蛮快，质量也不错，就是充电的时候手机会发烫，可能是充太快的原因吧。其他的都可以,充电;质量;NULL;,蛮快;不错;发烫;,1;1;-1;
1351,以为是设备坏了，原来是买来就是坏了,NULL;NULL;,坏;坏;,-1;-1;
1352,没有评价里说的那么不好，但是华为路由器有个控制软件，下载下来了，账号也注册了，就是没法用！客服也问了，重新下载也不行，这样不好啊！,评价;NULL;下载;NULL;,不好;没法用;不行;不好;,-1;-1;-1;-1;
1353,没有用过，不好说。,,,
1354,刚买就降价，差评,NULL;,差评;,-1;
1355,质量有保证，而且物流很快,质量;物流;,有保证;很快;,1;1;
1356,物流速度很快，东西很柔软，对孔准确，唯一的遗憾就是包的不紧实,物流速度;东西;NULL;NULL;,很快;柔软;遗憾;不紧实;,1;1;-1;-1;
1357,每个月都要买好多，配送速度一向没让我失望,,,
1358,有点甜腻，不太适合运动时喝。,NULL;,甜腻;,-1;
1359,。过几天以后,,,
1360,顿的简直了，指甲剪不动，鼻毛剪不断。,,,
1361,产品与实物不符，不能够完全的与手机贴合，影响了手机正面拍图功能，非常不满。看上去手机都劣质了！差评！难道我还要改手机不成？<br/>物流很快！真实评价希望商家勿扰。也给其他买家参考,实物;NULL;手机;NULL;物流;,不符;不满;劣质;差评;很快;,-1;-1;-1;-1;1;
1362,喜宝的米粉比较细腻，我都是和奶粉一起泡着给宝宝喝的，也比较好吞下去。,米粉;,细腻;,1;
1363,宝贝包装很好，和图片一样，谢谢了,包装;,很好;,1;
1364,搞不懂京东的模式，开个发票找客服，让我打京东那个电话，半天不接，又让在线客服，一问发票的事列举一系列清单，让自己点选，又回到了原点，最后等于放屁，让我感觉到了以前在zf窗口办事的样，这推那，那推这的，nb得很，最终事没解决,,,
1365,买多不给退，没拆封都不给，无语,NULL;,无语;,-1;
1366,挺香的就是包装是不是有点太糊弄了给个4星,包装;,挺香;,1;
1367,键盘用了没多久就不太好用了，方向键有点问题，毕竟便宜,方向键;NULL;,有点问题;便宜;,-1;1;
1368,口感真的是一般般了，反正个人感觉一般了。,口感;NULL;,一般般;一般;,0;0;
1369,大家在双11千万别买这家货，说话不算娄，说好双十一降价补回，而这家老板说好好的，收到货后就变心，这家老板是在双十一骗大家钱。而这家货也不是五升假的。买的人可以骂他,NULL;NULL;,变心;骗大;,-1;-1;
1370,商品给力,商品;,给力;,1;
1371,纸很薄，一般,纸;NULL;,很薄;一般;,-1;0;
1372,，乐色，视野比原车镜还少，这也叫广角？那原车的不是超广角了？我买的16.9的那款，说好的都是托，一看都是花钱请来评价的，希望对大家有帮助！,,,
1373,定位太不准，很多时候有500米误差,定位;,不准;,-1;
1374,商品不错，物有所值，值得购,商品;NULL;NULL;,不错;物有所值;值得购;,1;1;1;
1375,囤货。。。。。。。。。。。。。。,,,
1376,个人感觉一般吧,NULL;,一般;,0;
1377,稍微硬了点。味道很大。用开水烫了。温水泡了两个小时。还是有。 偏贵不值这个价。  而且咬腿的时候，另外的腿会挫脸和鼻子，我儿子不喜欢咬。,NULL;味道;NULL;NULL;价;NULL;,硬;很大;烫;偏贵;不值;不喜欢;,-1;1;-1;-1;-1;-1;
1378,笔芯质量真心不好，写到写到，墨水断断续续的，不满意。,质量;NULL;,不好;不满意;,-1;-1;
1379,速度一如既往地快，内包装有待改进，盒子都摔扁了&hellip;&hellip;&hellip;,速度;NULL;,快;有待改进;,1;-1;
1380,好挺好的,NULL;NULL;,好;挺好;,1;1;
1381,不能因为京豆来评价，确实不行，出水口是塑胶镀银的，立马申请退货,NULL;,不行;,-1;
1382,大米挺好的！新鲜！,大米;NULL;,挺好;新鲜;,1;1;
1383,包装极为简陋，分量很轻，做工一般，没有防扭开功能，只值20块，剩下的30给快递了，京东快递真不是盖的，懒得退货，如实汇报,包装;分量;做工;,简陋;很轻;一般;,-1;1;0;
1384,不是304钢吧？,,,
1385,好像跟超市的有区别！！！！！,,,
1386,昨天晚上下单，今天上午就到货！京东小哥杠杠的！,京东小哥;,杠杠的;,1;
1387,小面包 一般,NULL;,一般;,0;
1388,我真是想砸了这电脑，我才买了三天，卡了，最气人的是它一天到晚说我没管理员权限，文件删也删不了，如果你是学计算机的，你就更不要想它了，完全不用考虑，应该它跑程序也总是出错无法运行，然后用另外一台电脑跑又跑得起来了，这是什么问题，不要问我，我也不知道。真是让人愤怒，作为一个计算机专业的人，跑不了程序，我还不如去买一台3000的机子都好好的,NULL;NULL;,卡;愤怒;,-1;-1;
1389,东西不咋样，塑料的，高温下不知道会不会变形。,东西;,不咋样;,-1;
1390,质量真心不敢恭维，纸薄的都不能用，而且对比别家一点也不便宜，这样优惠活动让人恶心,质量;纸;NULL;NULL;,不敢恭维;不能用;不便宜;恶心;,-1;-1;-1;-1;
1391,看上去好小，还有优惠了，所以就缺配件了。缺了进水管，怎么洗衣服啊！?,看上去;,好小;,-1;
1392,这个价钱茶叶 已经很不错了,NULL;,不错;,1;
1393,颜色有差异，不是想像中的中国红，带点粉红。小米以前包装都是黄壳子，这次是白壳子包装。总之有点失望，理想和现实总是有差异的。,颜色;总之;,差异;失望;,-1;-1;
1394,太甜，味道都被遮了,NULL;,太甜;,-1;
1395,洗衣粉收到，不知是不是正品，因为5kg的汰渍洗衣粉，实际重量只有4.6kg！不知是买到假货了，还是厂家的包装量不足。,NULL;包装量;,假货;不足;,-1;-1;
1396,这是第二次购买了，质优价廉，还是非转基因的、快递速度快；今天中午下单明天到货，唯一是包装太简陋，油瓶外面包了层塑料布 、基本裸瓶。有一瓶压了个凹坑，不过还好没漏油,NULL;NULL;包装;NULL;,质优价廉;快;简陋;凹坑;,1;1;-1;-1;
1397,活动购入很划算，包装也很好，京东送货快服务好，买得放心,NULL;包装;送货;服务;,划算;很好;快;放心;,1;1;1;1;
1398,本来应该是2号19点前送达，京东物流超时到3号11点才送达！,,,
1399,不是智能裁剪，很多相片冲印出来角度不对，造成人像不完整,角度;NULL;,不对;不完整;,-1;-1;
1400,产品还没有用，看着做工不错,做工;,不错;,1;
1401,头一次给差评，拍的35元的四角气囊的壳，回来货不知道是被广告忽悠了还是店里发错货了，四角没气囊，普通壳。本来就二三十的东西，懒的换了,NULL;广告;,差评;忽悠;,-1;-1;
1402,京东一元秒杀的，抢到付了款才发现运费都是6块。,,,
1403,11.4 15:30拍下，11.7 12:00到货，个人京东购物史最慢的。线上线下第一次买这个，包装两边速撕口撕不开，药瓶是瘪进去的，不知真伪情况，觉得质量有点糙,购物;NULL;NULL;质量;,慢;撕不开;瘪;有点糙;,-1;-1;-1;-1;
1404,不怎么样，几乎都是花生，呵呵呵呵。,NULL;,不怎么样;,-1;
1405,一天快了三十秒，真  垃   圾。客服还什么都不懂，废物玩意<br/>妈   逼的为什么不能给一星,NULL;,快;,1;
1406,太辣了，不好吃，平时火锅店只能点微微辣的。,NULL;,不好吃;,-1;
1407,不知道好不好，还没有用，不过相信京东,,,
1408,特意用了一阵子才来评：<br/>外观：很美，适合男孩子，但是很沉。<br/>保温：极其差，一会儿就变成凉白开哈哈哈真的，不开玩笑。<br/>味道：稍微热一点的水，绝对不烫，比温水高一点点，吸管味道就有了！,外观;NULL;NULL;保温;NULL;,很美;适合;很沉;差;不烫;,1;1;-1;-1;1;
1409,感觉不太像新的，感觉是人家的退货，上面都是痕迹。看在便宜的分上，随便用用，懒得退换了。,NULL;,便宜;,1;
1410,非常满意的购物,购物;,满意;,1;
1411,可以使用，但是安装人员服务一般，有待提升，其他ok,NULL;服务;,可以;一般;,1;0;
1412,洗得太久浪费电,NULL;,费电;,-1;
1413,前一天购买，货还没到手上就降价了，还不给补差价，不给退货！说好的7天无理由退货的呢？,,,
1414,很失望，,NULL;,失望;,-1;
1415,lj，一点快感都没有，也不方便，那么大个东西也不能解放双手，总之一句话，谁买谁上当。,NULL;,不方便;,-1;
1416,质量很差，口味极不佳,质量;口味;,很差;不佳;,-1;-1;
1417,一直在用！很不错！,NULL;,不错;,1;
1418,老爸很满意,NULL;,满意;,1;
1419,手机收到还是挺不错的，然后验证了一下也是正品，嗯，用起来效果还可以吧，速度也挺快的，不错，相信小米吧，先用用看吧，嗯，黑色也是挺不错的，好看，这是没有3.5毫米耳机接口，但这个是最难受的。,手机;NULL;效果;速度;NULL;NULL;NULL;NULL;,不错;正品;还可以;挺快;不错;不错;好看;难受;,1;1;1;1;1;1;1;-1;
1420,口感一般，还是支持一下。 。。。。。。。。。。。。。。。。,口感;,一般;,0;
1421,这款手机挺不错的，玩游戏也不会卡，浏览网页也挺快的,手机;NULL;NULL;,不错;不会卡;挺快;,1;1;1;
1422,才买半个月就没反应了,NULL;,没反应;,-1;
1423,和华为watch2同样情况数据不一致，不知谁的准确。操控不灵敏，但对于这个价位来说还是可以的。,操控;,不灵敏;,-1;
1424,基于对华为的信赖从Q1换了这个千兆的分布式路由，结果很失望：1、主路由虽然能完美体现电信200M光纤，子路由却只有主路由的1/4。2、子路由与主路由之间超过2面墙基本就连不上了。,NULL;结果;,信赖;失望;,1;-1;
1425,一分不给，注意看一次性墨囊没有吸墨器！买错不退！！！,,,
1426,完全不吸汗，捂脚。看起来可以，穿起来特别不舒服。棉袜都是噱头，买袜子一定要看含棉量，后来我又去实体店买的100%纯棉袜，十六一双，价格也能接受。样式可以，但是穿起来实在不舒服，难受,看起来;穿起来;NULL;价格;样式;穿起来;NULL;,可以;不舒服;噱头;能接受;可以;不舒服;难受;,1;-1;-1;1;1;-1;-1;
1427,声音开到最大  但感觉还是小,NULL;,小;,-1;
1428,第一台单反，小白一个，道路还很漫长啊！包装没坏就是箱子底下封条已经开了。既然买了就不去想那么多。慢慢摸索吧！用段时间再看。,,,
1429,差评！京东客服电话的人工服务太难找，中老年人网购有疑问后，半天找不到人工台。还美其名曰为了方便客户，其实就是为了方便你们自己。,NULL;NULL;,差评;方便;,-1;1;
1430,好吃，果仁比较脆，肉比较多。,NULL;NULL;,好吃;脆;,1;1;
1431,信用ka申请太慢了，现在还没有信呢，啥情况,NULL;,太慢了;,-1;
1432,差评，没有用多久就出现书写不明显的问题了,NULL;,差评;,-1;
1433,发的老包装？？居然和买的另一款一模一样，关键那款两包装和这款一包装一个价~~。太厚了~~而且没生产日期,NULL;,太厚;,-1;
1434,下单四五天才收到够慢的，刚拿到还没拆开看！过后再追评吧,NULL;,慢;,-1;
1435,太淡,NULL;,太淡;,-1;
1436,钟面清晰，各角度都看得比较清楚，不是那么小巧,钟面;各角度;,清晰;清楚;,1;1;
1437,做工太差劲了，线头脱落,做工;线;,差劲;脱落;,-1;-1;
1438,手机用了一个月就出现问题要寄回去修，换了主板;这就有点不大高兴了，质量有点太那个了吧，还好服务态度不错,NULL;服务态度;,不大高兴;不错;,-1;1;
1439,收到了！买了好多好多！囤起来！一直支持京东！支持正品！凑活动多买点,NULL;,正品;,1;
1440,一直吃这种米，好吃。。。。。。,NULL;,好吃;,1;
1441,还可以！就是价格乱标,NULL;价格;,还可以;乱标;,1;-1;
1442,感觉有点带不稳,NULL;,不稳;,-1;
1443,这个传输很一般，还卡,传输;NULL;,一般;卡;,0;-1;
1444,喜欢。,NULL;,喜欢;,1;
1445,京东服务差,京东服务;,差;,-1;
1446,明明图片上画的是宽挂面，收到的是细挂面，这不是欺骗消费者吗？我还买了两包，啥时候能吃的完！,,,
1447,用了一天，掉一下，碎的一塌糊涂！旁边不是软边特别容易碎，敬慎购买！问了客服，用了一天就变成这样，竟然没有人搭理，买的时候可是各种积极！这么贵的膜，不值！,NULL;NULL;NULL;膜;,碎;一塌糊涂;贵;不值;,-1;-1;-1;-1;
1448,很不错(*?&acute;╰╯`?)?,NULL;,不错;,1;
1449,感觉还行吧！如果有保温功能就更好了？,NULL;,还行;,1;
1450,不错........,NULL;,不错;,1;
1451,卖家说边框颜色一样。能告诉我是什么相机拍的么，效果这么好,,,
1452,超级难吃，，什么鲜香味，，味道那个味道简直受不了，，，,NULL;味道;,难吃;受不了;,-1;-1;
1453,这次买到歪的了、没有水份干的很、真气愤,NULL;,气愤;,-1;
1454,客服态度很差，这酒都是这样装？,客服态度;,很差;,-1;
1455,速度很快，但都碎了,速度;NULL;,很快;碎;,1;-1;
1456,打开就黑屏，等了半个小时还是一样,NULL;,黑屏;,-1;
1457,很漂亮的颜色，满足了，以后想涂哪个颜色都可以，性价比还是不错的，建议大家可以购买哦?！,NULL;颜色;颜色;性价比;NULL;,漂亮;满足;可以;不错;可以;,1;1;1;1;1;
1458,非常好用，送货速度快，服务态度好！,NULL;送货速度;服务态度;,好用;快;好;,1;1;1;
1459,表带太容易断,表带;,容易断;,-1;
1460,分区软件识别不了，然而找客服打死不说话，今天说了一句，然而只说了一句又不说了,,,
1461,金六福 经典四星 45度白酒 整箱装,NULL;,经典;,1;
1462,买了绝对后悔，这鼠标绝对不符合人体工程学，用起来手都快报废了。,鼠标;NULL;,后悔;报废;,-1;-1;
1463,塑料感太强了吧。。。。,塑料感;,太强;,-1;
1464,东西已经收到但是封口是开的，从没遇上过，是不是谁给吃了,,,
1465,大号的也很小，以为多大呢。买来丢车里了，当个装饰品,大号;,很小;,1;
1466,好速度很快便宜,NULL;速度;NULL;,好;很快;便宜;,1;1;1;
1467,内裤还没穿，商家天天催给他评价！有意义吗？又不是第一天在京东买东西，难道我不知道可以评价。。。,,,
1468,假的，很难吃，希望三思而后行,NULL;NULL;,假;难吃;,-1;-1;
1469,买来还没有使用，不知道效果怎么样，先给个好评吧。,NULL;,好评;,1;
1470,都不对孔的，收到秒扔掉,NULL;,不对;,-1;
1471,京东各种商品，促销活动浮动大，差评！,NULL;,差评;,-1;
1472,非常好用  价格实惠,NULL;价格;,好用;实惠;,1;1;
1473,耗电，真的特别耗电！,NULL;NULL;,耗电;耗电;,-1;-1;
1474,1、跟X5C无线接入搭配，无法调用云台。想要调用，只能有线接入2、另外，白天可以，晚上效果很差。3、差评。,效果;NULL;,很差;差评;,-1;-1;
1475,新买的手机两天就降价，还口口声声说不用等双十一降价可以补偿差价。结果都是文字游戏，已经激活又不能退货，哎糟心糟心,NULL;NULL;,糟心;糟心;,-1;-1;
1476,烂京东，服务一塌糊涂,NULL;服务;,烂;一塌糊涂;,-1;-1;
1477,卡扣卡不住,NULL;,卡不住;,-1;
1478,还可以，就是穿脱不方便~,NULL;穿脱;,还可以;不方便;,1;-1;
1479,标志与图片不相符，感觉被骗了！本来就是看中那标志才买的，实物太土了，根本不是那个级数,图片;NULL;NULL;,不相符;被骗了;太土;,-1;-1;-1;
1480,说好8.5折，根本不返现，骗人,NULL;,骗人;,-1;
1481,我不知道牛肉干里还有这样的,,,
1482,总是破 建议不要买,NULL;NULL;,破;不要买;,-1;-1;
1483,东西还可以就是物流不好，送货上门，到了小区门口就不管了,东西;物流;NULL;,还可以;不好;送货上门;,1;-1;1;
1484,一分价钱一分货，最前面是塑料壳非常薄不好用！,塑料壳;NULL;,薄;不好用;,0;-1;
1485,卡的简直没用不了，要么黑屏，要么软件都打不开！,NULL;NULL;软件;,卡;黑屏;打不开;,-1;-1;-1;
1486,物流很好，买了很多次了，效果很好,物流;效果;,很好;很好;,1;1;
1487,键盘还不错，送的键帽不能用，故意降了假不能用减120的劵，坑,键盘;键帽;NULL;,不错;不能用;坑;,1;-1;-1;
1488,不满意，你的良心不会痛么,NULL;,不满意;,-1;
1489,赠品，还行，不过不是9.9的，好像是6.9的，不一样。不是说三岁以才能吃，这款是什么年龄都能吃，是不是配错了,NULL;,还行;,1;
1490,好评，继续光顾，发货速度杠杠滴,NULL;发货速度;,好评;杠杠滴;,1;1;
1491,不错的宝贝，儿子最喜欢开心果。,NULL;宝贝;NULL;,不错;喜欢;开心;,1;1;1;
1492,出库前有质检员检查吗？,,,
1493,东西很好的，发货也快，相信京东！,东西;发货;,很好;快;,1;1;
1494,刚买就降价，差评！   退货处理速度慢，差评！，，，自营产品物流非京东配送（圆通快递送京东件）差评,NULL;处理速度;NULL;NULL;,差评;慢;差评;差评;,-1;-1;-1;-1;
1495,刚买就降价，还不退差价，机子用起来也卡，差评一个,用起来;NULL;,卡;差评;,-1;-1;
1496,运气不好有两个亮点，烦。,运气;NULL;,不好;烦;,-1;-1;
1497,已经不错，昨晚和孩子找水箱找好久，还玩不来，清扫一次，觉得已省不少力气活。就是水箱的水不经用，我家面积太大了，要求太高的要注意，毕竟是机器，但细小垃圾都收走了，大爱！,NULL;NULL;面积;要求;NULL;,不错;不经用;太大;太高;大爱;,1;-1;-1;-1;1;
1498,还行，发货太慢太慢,NULL;发货;,还行;太慢;,1;-1;
1499,售后太差了，送的赠品忘了，催了好几次，给他们说要退货不要了，结果他们又把赠品发过来了，真的让人很生气,售后;NULL;,太差;生气;,-1;-1;
1500,不太实用，占不住,NULL;,占不住;,-1;
1501,包装完整，送货上门，还没安装，装后看效果,包装;NULL;,完整;送货上门;,1;1;
1502,高端大气上档次的一款波轮洗衣机，洗衣服方便超干净，尤其洗羽绒服，效果非常好，赞赞,NULL;NULL;洗衣服;NULL;效果;NULL;,高端大气;上档次;方便;干净;好;赞;,1;1;1;1;1;1;
