row_id,content,theme,sentiment_word,sentiment_anls
2629,太辣了不好吃。只有一个辣字，其他什么味道也没有。,NULL;,不好吃;,-1;
2630,实用！,NULL;,实用;,1;
2631,100%二手接盘，一看就是上过机的，伤痕（划痕）累累，但是缺货严重没办法留下用吧。,NULL;,二手;,-1;
2632,打开是漏的，米不知道是几年的陈米了，全部都发黄了，太恶心了,NULL;NULL;NULL;,漏;发黄;恶心;,-1;-1;-1;
2633,公司备用，质量不错,质量;,不错;,1;
2634,架子都挤弯了,,,
2635,外观漂亮，箱体较轻，但是也比较软，不是很结实的样子。不过登机箱不托运还好，如果托运的话就不安全了,外观;箱体;NULL;,漂亮;轻;软;,1;1;1;
2636,价格比我们这边超市贵，管它有没吃肉，不好吃。,价格;NULL;,贵;不好吃;,-1;-1;
2637,袜子不是纯棉的，穿上臭脚,,,
2638,不够耐用，每天都要充！,NULL;,不够耐用;,-1;
2639,差评不会再买第二次了,NULL;,差评;,-1;
2640,油一塌糊涂，看了吓人，这叫谁还敢来买啊,NULL;NULL;,一塌糊涂;吓人;,-1;-1;
2641,从9月27日开始，历时34天，第一次收到甩干坏的，申请了换货，换货寄送地址送错，拒收后6天经过京东客服介入，才发货，到今天终于收到了，试用了没有问题。,NULL;,没有问题;,1;
2642,来来来,,,
2643,信赖京东的物流,京东;,信赖;,1;
2644,有点矮了。其他方面都还挺好。,NULL;NULL;,有点矮;挺好;,-1;1;
2645,这个拿出来秒杀，京东你坑老子呢！,NULL;,坑;,-1;
2646,皮质有点硬。不如店里直接购买的，还不用这个价格。,皮质;,有点硬;,-1;
2647,一般，有点酸,NULL;,一般;,0;
2648,丢了一次，重买，感觉这个价位的不二之选,,,
2649,产品都没收到，不知道为啥,,,
2650,刚买过就大降价快一半，哪有这样的,,,
2651,快递依旧很给力 快递小哥辛苦了,快递;快递小哥;,给力;辛苦;,1;1;
2652,美的服务就这样收工了。,,,
2653,挺好的，还有赠品,NULL;,挺好;,1;
2654,一撕开粉都喷出来了 弄一身,,,
2655,贵了100,NULL;,贵;,-1;
2656,这奶粉容易上火,NULL;,容易上火;,-1;
2657,第一，机器有些地方有些磨痕，不过不细看看不到。第二，熨衣服的时候，出气口有点滴水，不过我之前买的也有些，能理解。第三，我很不喜欢的是管子外面是用绳线缠的，有些地方都有些磨毛了，这点我非常不理解，而且烫衣服的时候，那个地方比较烫。<br/>除了以上一些情况，烫衣服效果还是可以的，毕竟1800瓦的，功率大了还是好些,NULL;管子;NULL;效果;,磨痕;不喜欢;较烫;可以;,-1;-1;-1;1;
2658,款式时尚，品质不错，满意,款式;品质;NULL;,时尚;不错;满意;,1;1;1;
2659,地球人都知道-外包装太简陋，商品盒子全变形...,外包装;盒子;,简陋;变形;,-1;-1;
2660,一般般，比较稀，不怎么好的样子,NULL;NULL;样子;,一般般;稀;不怎么好;,0;-1;-1;
2661,包装没有减震，运货过程包装盒已经有磨损，还好没有伤及硬盘，望卖家注意。,包装盒;,有磨损;,-1;
2662,音效不如预期，室外蓝牙稳定性不是最好。,稳定性;,不是最好;,-1;
2663,开瓶器都没一个。,,,
2664,不去屑,,,
2665,京东东西**点，买什么降什么,,,
2666,出水口离进水口比较近，再远些就好丁。,,,
2667,味道刺鼻，整了什么添加剂呀,味道;,刺鼻;,-1;
2668,物流很快，比国内品牌的价格高，不知道性价比如何了！,物流;价格;,很快;高;,1;1;
2669,不好用糊锅，热的慢，不如自己家的炒菜锅。,NULL;糊锅;,不好用;慢;,-1;-1;
2670,略有点淡,NULL;,有点淡;,-1;
2671,不是很精致 粗糙了点。充电发热现象有 这点能接受。但是插头不是很好插，充电速度不象是5V的 有点慢。,充电;插头;NULL;,粗糙;不是很好;有点慢;,-1;-1;-1;
2672,挺好的，还不错,NULL;NULL;,挺好;不错;,1;1;
2673,味道是不错，可就是火气大，吃完牙痛。,味道;,不错;,1;
2674,大家看图片，实际收到的和网上的配料不一样，实际收到的含有白沙糖,,,
2675,速度挺快，就是体积有点大！,速度;体积;,挺快;有点大;,1;-1;
2676,买到家，就尝了尝，味道不错啊。价格亲民,味道;价格;,不错;亲民;,1;1;
2677,还好，，，，，，，，，，,NULL;,还好;,1;
2678,寝室用的，没抓到蟑螂！！！引诱剂是颗粒状，不太好用，建议加钱上安速。,,,
2679,凑单买的正章大牌就买了看着不错，相信京东,看着;,不错;,1;
2680,0.0不知道咋样,,,
2681,商品质量与价格不成正比！个人感觉上当受骗了！,NULL;,受骗;,-1;
2682,卡拉卡拉卡拉卡拉啦啦啦8看看5看看,NULL;,卡;,-1;
2683,有点贵呀，比大超市里贵一些。,NULL;NULL;,有点贵;贵;,-1;-1;
2684,粘胶厉害&hellip;&hellip;,粘胶;,厉害;,1;
2685,东西非常好，速度快，质量吧，价钱便宜，京东，强大，感谢京东配送小哥，服务非常周到，五分，值得推荐给各位,东西;速度;价钱;NULL;服务;NULL;,好;快;便宜;强大;周到;值得推荐;,1;1;1;1;1;1;
2686,发货挺快，东西太不敢恭维，比原来用的差多了，外壳太薄，火太大了灯还没灭饼都胡了，总之不咋地&hellip;&hellip;,发货;东西;外壳;NULL;总之;,挺快;不敢恭维;太薄;太大;不咋地;,1;-1;-1;-1;-1;
2687,入冬就是要补补补&hellip;&hellip;杂粮什么的老人孩子都吃一点。,,,
2688,毛巾质量不错！,质量;,不错;,1;
2689,换了这个交换机家里的数字电视经常断网,,,
2690,可以吧，消耗品就这样呗,NULL;,可以;,1;
2691,物流超快，东西很差劲,物流;东西;,超快;差劲;,1;-1;
2692,蛮不错的，非常好用，洗的很干净,NULL;NULL;洗;,不错;好用;干净;,1;1;1;
2693,一般吧，凑合着穿，不是我理想的,NULL;,一般;,0;
2694,实际上比图片看起来的要差一些,看起来;,差一些;,-1;
2695,勉强用用，麻麻地啦,,,
2696,锅不行，粘锅,锅;NULL;,不行;粘锅;,-1;-1;
2697,东西可以。,东西;,可以;,1;
2698,戴着老是掉不好用,NULL;,不好用;,-1;
2699,没有用大箱子全部打包送，就原包装贴个快递单就送了，我一起下单的，都分开打包了，快递送来时说有好几个包裏，真是很无语,NULL;,无语;,-1;
2700,这个电脑组装有问题吧，为什么两遍的间隙大小不同呢？别说这是正常现象，这种问题，用了一段时间后偶然间发现的，被坑的感觉,组装;NULL;NULL;,有问题;正常;坑;,-1;1;-1;
2701,第二次购买了，三件，这次的质量跟第一次比差了不少，色差，木结都比第一次买的要多得多！十分不爽！中评吧！,质量;NULL;NULL;,差;不爽;中评;,-1;-1;0;
2702,说实话，我真的是很多年的蜜丝佛陀粉了，一直用它们品牌的睫毛膏。但是我很确定我买到的绝对是假的，太晕妆了，定型效果浓密纤长效果，跟店里买的，效果差太多。我昨天晚上收到之后试了一下，半个小时没揉它，自己就花掉了。好大的黑眼圈。很生气，虽然第一次买也可能会是最后一次在这买东西了,NULL;NULL;效果;NULL;,假;晕妆;差太多;好大;,-1;-1;-1;-1;
2703,有点酒味,,,
2704,连接有时候不太好，音质一般般的很，蓝牙都这样<br/>299买的亏了，大家以后照着199买就行，也不能保价,连接;音质;NULL;,不太好;一般般;亏了;,-1;0;-1;
2705,送货快，还比较实用。,送货;NULL;,快;实用;,1;1;
2706,一叶子这牌子一点都不好，买了用了之后才跟同事说买了这，同事立马叫起来买之前为什么不跟她说，就可以叫我不要买，一个个都围过来说不好，为什么居然有这么多人说好，汗-_-||,牌子;NULL;,不好;不好;,-1;-1;
2707,有点卡不知道为什么，懒得换了,NULL;NULL;,有点卡;懒得换;,-1;-1;
2708,买这么多，就这个包装破了,包装;,破;,-1;
2709,声音特别大，吸力一般，不适合家用,吸力;NULL;,一般;不适合;,0;-1;
2710,包装很差,包装;,很差;,-1;
2711,东东很好用，不错！！！！！！！！！、、、、,东东;NULL;,好用;不错;,1;1;
2712,用处不大，基本上搁置了。不过东西做得很软，不会伤到宝贝。还是很用心。,NULL;NULL;,不大;用心;,0;1;
2713,还不错，就外面那层膜最好撕掉，不然影响口感的。撕掉会比较好吃！,NULL;,不错;,1;
2714,这大概是我在京东购物以来第一次没给全五星。第二次购买同款记录仪，之前的那个记录仪使用也是总体满意的。但是这次买的这个有些不完美 &mdash;&mdash; 外部包装完好、内部包装却有有开裂现象，镜头保护贴纸也是歪的，这些不禁使我怀疑会不会是拿到了别人的退换货。产品本身功能上没有什么明显问题，就留下来用吧，毕竟我也不是动辄退货的那种顾客，不是致命问题一般也不会太认真。,总体;NULL;包装;问题;,满意;不完美;完好;一般;,1;-1;1;0;
2715,第一个电和最后一个电耐用，其他两个一会就没了，次品，才冲两块电池差不多,NULL;,次品;,-1;
2716,水果味的酸奶，小孩特别喜欢喝，特别浓，很不错的哦，感觉比原味的要好的多,NULL;NULL;,喜欢;不错;,1;1;
2717,根本装不上，只能废弃，差评,NULL;,差评;,-1;
2718,庄臣的。应该可以。,,,
2719,这个手机还行吧，在2000多的手机当中还算不错了，就是手机买回来有点小卡，总是要慢那么0.2秒左右不管你操作什么，特别是打字慢的更凶了，还是劝广网友合理爱国，别被打着爱国的旗号给绑架了，合理支持国产别盲目跟从,手机;NULL;NULL;NULL;NULL;,还行;不错;慢;慢;合理;,1;1;-1;-1;1;
2720,像是个袖珍版的，板子又窄又短，一米七的个头躺上去脑袋是着地的，头枕是用来枕脖子的。钢管用料很差，又细又薄。,板子;用料;NULL;,短;很差;薄;,-1;-1;0;
2721,评价无效，那就给两颗星,评价;,无效;,-1;
2722,昨天下单，今天收到，物流速度绝对是快。刚回来就打开，东西挺好的，看完说明书，试测一下，和今天在医院测的一样，以后就不用再跑医院了，方便，很满意！,物流速度;东西;NULL;NULL;,快;挺好;方便;满意;,1;1;1;1;
2723,收到好久了，一直没有时间评论，一盒快用完了，刷牙的时候觉得没有以前用云南白药牙膏的那种味道，刷完感觉不到很清爽的那种感觉,,,
2724,非常容易起雾，差点看不清出事故。差评。就是最差的塑料件，防雾镀层跟没有的没什么差别,NULL;,差评;,-1;
2725,之前没看到是随机发的，想要银色但是没货，问了客服什么时候有银色的，客服说要一星期，也没告诉我这个是随机发，有可能不是银色，回来后不是银色的又不能换，京东最不满意的一次购物。,京东;,不满意;,-1;
2726,后面那个镜子没什么用，拉长之后转动锁住那个功能不太好用，有时要转几下才到位，不然就没锁住。用了一次没用了。,镜子;,没什么用;,-1;
2727,京东老顾客，经常光顾，京东自营，物流杠杠，质量杠杠，值得信赖！,物流;质量;NULL;,杠杠;杠杠;值得信赖;,1;1;1;
2728,速度很慢，而且还有一袋有漏的。,速度;NULL;,很慢;漏;,-1;-1;
2729,做工精细.颜色漂亮.东西很不错.大品牌放心购买!,做工;颜色;东西;大品牌;,精细;漂亮;不错;放心;,1;1;1;1;
2730,就放塑料袋里的，送过来盒子都挤烂了，还脏兮兮的，这毕竟是卫生用品啊，真是太不负责任了,盒子;NULL;NULL;,烂;脏兮兮;不负责任;,-1;-1;-1;
2731,正在用，看起来不错。想买的可以入手。,看起来;,不错;,1;
2732,买回来看，外观属普通没有惊艳，售后很好的，有耐心,外观;售后;NULL;,没有惊艳;很好;耐心;,-1;1;1;
2733,不值*里面还有碎棉。。。,NULL;,不值;,-1;
2734,贴上去之后居然有水印，就是屏与膜贴合不紧密的现象，偶尔还会感觉影响到触摸反应,,,
2735,家里买来用的，挺方便的，但是京东越来越抠门了，东西不便宜而且钻石会员什么都不送了，起送门槛也越来越高了！,NULL;京东;东西;,方便;抠门;不便宜;,1;-1;-1;
2736,装不稳，没说明书,装;,不稳;,-1;
2737,感觉还可以，就是感觉有点厚了,NULL;NULL;,还可以;有点厚;,1;-1;
2738,可以，刚收货一天便宜50元一箱，郁闷,NULL;NULL;NULL;,可以;便宜;郁闷;,1;1;-1;
2739,就是太贵了，其他的还好,NULL;NULL;,太贵;还好;,-1;1;
2740,京东的东西变价的速度比变脸还快，价格太不稳定了。差一天，又便宜了。东西还没用，不知道怎么样，但是这价格变得这么快让人心里不舒服！！真想给一颗星！,速度;价格;NULL;心里;,快;不稳定;便宜;不舒服;,1;-1;1;-1;
2741,书是盗版的吧，反正将就看,书;NULL;,盗版;将就看;,-1;-1;
2742,很实惠，不错，一直在用！,NULL;NULL;,实惠;不错;,1;1;
2743,老妈吃了以后说有发霉的又难吃，心碎啊，还是买三只松鼠吧,NULL;NULL;NULL;,发霉;难吃;心碎;,-1;-1;-1;
2744,这样子的包装我非常不满，还不如**西的包装,包装;,不满;,-1;
2745,用用这种超薄的，感受一下，广告做的挺好，吸引买的！包装比较差，盒子被压瘪啦！,NULL;广告;包装;盒子;,超薄;挺好;较差;瘪;,1;1;-1;-1;
2746,用完回头再来评价，目前为止还没有呢,,,
2747,不好，太差了，不仅太慢了，而且戴着太大了,NULL;NULL;NULL;,不好;太差;太大;,-1;-1;-1;
2748,物流极慢  别说什么这是快递的事情与你们无关  与你们无关就不要和这种快递合作,物流;,极慢;,-1;
2749,盗版书,,,
2750,安装太费事 没有安装工具 说明书不详细,安装;说明书;,费事;不详细;,-1;-1;
2751,看评论说很小，让我购买的时候有点担心，到手后发现叉子和勺子是很大的，对于三岁的小朋友来说，而且勺子前端是平的，感觉好大，其中一个碗确实是太小了，但是另一个还好，杯子大人拿起来是小，但是小朋友用的，所以还好,评论;勺子;NULL;碗;NULL;NULL;,很小;很大;好大;太小;还好;还好;,1;1;-1;-1;1;1;
2752,其中安卓的头不好使，接触不良,头;NULL;,不好使;接触不良;,-1;-1;
2753,一如既往，质量不错，值得购买！,质量;NULL;,不错;值得购买;,1;1;
2754,质量不咋地 穿了一次就破了 还是破的脚后跟 以后还是地摊买袜子吧 便宜还结实,质量;NULL;NULL;NULL;,不咋地;破;破;便宜;,-1;-1;-1;1;
2755,插空距离还是不够，有点费劲,NULL;NULL;,不够;费劲;,-1;-1;
2756,买回来试了，自己安装的，很简单，比较满意！,NULL;NULL;,简单;满意;,1;1;
2757,容易掉，粘不紧,NULL;NULL;,容易掉;粘不紧;,-1;-1;
2758,这次这个和以前的相比量好像要少一些，以前是基本在第一格线，现在这个在一格线以下，要少很多，不知道什么情况，也比之前代购的要少。不知道这次这个图片能通过审核么！,,,
2759,信任京东这么久，这次真的要给差评，纸张印刷质量惨不忍睹，业角还有褶皱的痕迹，不像正版，服了，很差的一次体验,京东;NULL;印刷质量;体验;,信任;差评;惨不忍睹;很差;,1;-1;-1;-1;
2760,差，差差，希望大家也考虑清楚,NULL;,差;,-1;
2761,说实话 味道和口感都一般般 一分钱一分货吧,口感;,一般般;,0;
2762,没有想象的那么好，十字键还有问题。最主要是我买来是打王者荣耀的。呢吗还要激活映射,NULL;,有问题;,-1;
2763,一般吧，只有榨橙汁好用。,NULL;NULL;,一般;好用;,0;1;
2764,没有想象中防味，盖上盖还渗水,NULL;,渗水;,-1;
2765,好用。  就是有点小贵,NULL;NULL;,好用;有点小贵;,1;-1;
2766,自从喝过荷高牛奶之后，孩子一直爱喝荷高。,,,
2767,前阵子住院，<br/>怎么说呢，壳子本身不错，<br/>但是6S的壳子跟6组成套餐是什么意思？,壳子;,不错;,1;
2768,切口不齐，纸又粘连，抽纸时会抽烂。,NULL;,烂;,-1;
2769,用维达N年了，自从有香的纸巾就用了,,,
2770,京东全球购，价格便宜，保温效果很好,价格;效果;,便宜;很好;,1;1;
2771,以为这是那么久了不会有末等奖     抽到末等奖  心凉半截   也懒得换了   听说256的内存才是一等奖,NULL;NULL;,心凉;懒得换;,-1;-1;
2772,今天刚刚收到货，这是使用京东快递以来，京东第一次送货不准确，系统显示11.1日送到，然后是11.2日送到，这是小事，还有快递员让自己距离他0.5km的地方自己去取，他说太累了，这也是小事。<br/>问题的关键是这款产品怎么样，核心点，慢，特别慢，比我的旧笔记本还慢。真心慢，系统激活后，重启了2次，还没有开始装软件。<br/>第二，主机声音大，还是便宜没好货呀！<br/>购买时，请慎重！,送货;NULL;NULL;NULL;NULL;NULL;,不准确;慢;慢;慢;慢;慎重;,-1;-1;-1;-1;-1;-1;
2773,与描述的一样，性价比还是不错的。就是颜色容易掉，推荐，值得购买。,性价比;颜色;NULL;NULL;,不错;容易掉;推荐;值得购买;,1;-1;1;1;
2774,哎，第一次觉得京东的物流那么不靠谱，足足五天六天才拿到，真是够够的。,物流;,不靠谱;,-1;
2775,感觉就是个普通洗发水，包装好看,NULL;包装;,普通;好看;,0;1;
2776,抽单,,,
2777,跟第一次买的不一样，这次应该是旧款，还是这是假的，没第一次买的好用，伤心,NULL;NULL;NULL;,假;好用;伤心;,-1;1;-1;
2778,不防水，贵了。不值42块钱,NULL;NULL;,贵;不值;,-1;-1;
2779,讲真，感觉不值这个价格！,价格;,不值;,-1;
2780,东西还可以，就是包装简陋了些。,东西;包装;,还可以;简陋;,1;-1;
2781,一个包拆了三次送，送了三次，价格降了不保价，不是京东自营，不是京东配送，客服态度差，没给送发票，无力吐槽。,客服态度;NULL;,差;无力吐槽;,-1;-1;
2782,不能买   稍微说一点对这东西不好的话马上就不让发表  真不知道这种商品为啥还要拿出来卖,,,
2783,再也不用到处拉插线板了，很方便，但就是有时候很用劲插不进去！,NULL;,方便;,1;
2784,不错，打开很快就吃光光了,NULL;NULL;,不错;很快;,1;1;
2785,想信京东出品，继续支持京东。,,,
2786,还没用，看着可以，我买的时候怎么没送我暖贴？好坑,看着;NULL;,可以;好坑;,1;-1;
2787,好大一瓶经济实惠好用老牌子,NULL;NULL;NULL;NULL;,好大;经济;实惠;好用;,-1;1;1;1;
2788,这块表真心不怎么样好后悔买了,NULL;NULL;,不怎么样;后悔;,-1;-1;
2789,价格贵了点，弹簧力度不大，估计过段时间使用效果就不好了,价格;弹簧力度;,贵;不大;,-1;0;
2790,不错，快递给力，当晚送达。,NULL;快递;,不错;给力;,1;1;
2791,还可以吧，没有味道，保湿效果一般,NULL;保湿效果;,还可以;一般;,1;0;
2792,还不错吧，感觉手型和我有一点不合。。。然后LT和RT有点容易没按下去。。。,NULL;手型;,不错;不合;,1;-1;
2793,盒子破裂,盒子;,破裂;,-1;
2794,第一次购买,,,
2795,信赖&hellip;&hellip;,NULL;,信赖;,1;
2796,印刷还不错，做活动的价格也便宜，但内容太简单了，每个神仙只有24页，只能作为八仙的启蒙读物，如果以前的八仙传说只有这么点，相信不会流传千古，等孩子长大了再让他看详细的书籍吧。,印刷;价格;内容;,不错;便宜;简单;,1;1;-1;
2797,坑，坑，坑，,NULL;NULL;NULL;,坑;坑;坑;,-1;-1;-1;
2798,不知道好不好，第一次买的,,,
2799,收到二手的，不开心，能用就不换了。,NULL;NULL;,二手;不开心;,-1;-1;
2800,买完没多久就降价，对于资深购物者来说，客服的答复太应付，东西还可以，服务也需要加强啊,东西;,还可以;,1;
2801,除垢不错，但是放在外面失效太快，省了半瓶浪费了，减颗星,NULL;外面;NULL;NULL;,不错;失效;太快;浪费;,1;-1;-1;-1;
2802,凑了一套 没仔细看 先评价,,,
2803,做工还可以，就是价格稍贵。,做工;价格;,还可以;稍贵;,1;-1;
2804,还是一样，没变化,,,
2805,上午定的下午就拿到了。佩戴比较舒适，配对简单，音色只能说一般，这个价位的蓝牙耳机也差不多，基本满意,佩戴;配对;音色;耳机;,舒适;简单;一般;满意;,1;1;0;1;
2806,和实物一致，也不贵，还是可以,NULL;NULL;NULL;,一致;不贵;可以;,1;1;1;
2807,转VGA用的是原装苹果的，再看这个简直用的心情都没有，总有一种廉价的感觉，试用暂未发现问题,NULL;,廉价;,1;
2808,买15个弹簧有两个不好   很松,弹簧;,不好;,-1;
2809,袜子一般般的，没有什么特别之处，还好可以穿。,袜子;,一般般;,0;
2810,感觉还可以，说是无添加，但还是很白，没添加啥了？,NULL;,还可以;,1;
2811,是所谓的营养品。看不到什么效果？,,,
2812,味大得很,,,
2813,打了一个小时都没有打发,,,
2814,挺好吃的，价格又实惠。,价格;,实惠;,1;
2815,多次购买了,,,
2816,手机出厂时都没品控吗，按键一点弹性都没有，这么明显的问题都不能发现吗，我很怀疑这批手机的品质问题，不想用半年换机,,,
2817,广告多的让人发疯，不如某盒，好在便宜吧,NULL;,便宜;,1;
2818,很好用，质量很好，方便,NULL;质量;NULL;,好用;很好;方便;,1;1;1;
2819,美的空调应该算很经典了，声音确实比较小，希望远期质量不错。,空调;声音;质量;,经典;较小;不错;,1;-1;1;
2820,京东快递没得说，超级快，东西一直很信任，但是今天收到的这个就让我很不开心了,快递;NULL;东西;NULL;,没得说;快;信任;不开心;,1;1;1;-1;
2821,不好选无星，太差劲了,NULL;NULL;,不好;差劲;,-1;-1;
2822,"活动买的,  价格便宜, 送货也快, 五星好评...",NULL;送货;NULL;,便宜;快;五星好评;,1;1;1;
2823,洗完头发非常毛糙，从未用过如此差的洗发水，怀疑假货，用来洗真丝被子用了，一星是给物流,头发;NULL;洗发水;,毛糙;差;假货;,-1;-1;-1;
2824,一直在喝。,,,
2825,手机应该是正品，但是价格浮动太大，还没敢激活，怕价格保护都不靠谱！但是现在快递包装太不靠谱了，以前还有个纸箱，现在直接气泡袋，盒子都撞掉角了！,手机;价格浮动;NULL;包装;,正品;太大;不靠谱;不靠谱;,1;-1;-1;-1;
2826,一直买的 价格不错 物流给力,价格;物流;,不错;给力;,1;1;
2827,怎么放它的底部都不平 失望,底部;NULL;,不平;失望;,-1;-1;
2828,根本就用不了，手把这的那个地方螺丝坏了，弄不上,NULL;螺丝;,用不了;坏;,-1;-1;
2829,盖布易坏，买家答应换新的给我，暂时还没收到，挂不了太多衣物，钢管运输中有点点变形不影响使用。,NULL;NULL;NULL;,易坏;变形;不影响;,-1;-1;0;
2830,还是可以的，洗手什么的,NULL;,可以;,1;
2831,东西很不错，期待用效果,东西;,不错;,1;
2832,无线鼠标无线键盘套装,,,
2833,一分价钱一分货，这个真心不好用，手感不柔软，吸尿后表面有潮湿感，宝宝用了红屁股,NULL;手感;,不好用;不柔软;,-1;-1;
2834,目前没有什么问题，还不错，一分钱一分货。,NULL;,不错;,1;
2835,这个手机给弟弟买轻了，这几天很忙，没有问他用的怎么样，今**，他告诉我一回来锁屏划开时有点不灵，手机今天轻摔了下，屏幕竟然碎了，在此之前他一次都没摔过，真的醉了，问客服，也没给个解决方法，反正就是不想管，自己的问题，,NULL;屏幕;NULL;,不灵;碎;醉了;,-1;-1;-1;
2836,不好吃发霉的味道,NULL;味道;,不好;发霉;,-1;-1;
2837,收到货的时候盖子都没盖紧是什么鬼，都有点不敢用，怎么能这么粗心呢,NULL;NULL;,不敢用;粗心;,-1;-1;
2838,很满意的一次购物，质量好物流快，下次一定还会再光顾的哦！,NULL;质量;物流;,满意;好;快;,1;1;1;
2839,护舒宝刚出的这款新款卫生巾，液体的非常好用，自从出了这个新款，我把别的牌子的卫生巾都给停了。??,NULL;,好用;,1;
2840,京东就是呵呵，价格保护形同虚设。转战某宁**了,,,
2841,质量太差了，下次不会在买了,质量;,太差;,-1;
2842,正在使用中，还不错。。。。。。。。。。。。,NULL;,不错;,1;
2843,质量还可以，就是保温效果不怎么好,质量;效果;,还可以;不怎么好;,1;-1;
2844,感觉一般班，买了两瓶，就吃一点点,NULL;,一般;,0;
2845,不错的 很方便 还有一个东西可以防止风吹过来的时候掉下去 虽然我不知道那叫什么? 物流也非常的快 第二天就到了,NULL;NULL;物流;,不错;方便;快;,1;1;1;
2846,标的原价不是真的，原价和打折价差不多，不过总体便宜了几块钱，算是原谅你们了。不过被骗的感觉真的不好,总体;NULL;感觉;,便宜;被骗;不好;,1;-1;-1;
2847,太假了，贴上去了一个小时一点温度都没有，太假了，上当了,NULL;NULL;,太假;太假;,-1;-1;
2848,谢谢，送货师傅，辛苦了。,NULL;,辛苦;,1;
2849,因为口罩问题不能给好评，太勉强,NULL;,勉强;,-1;
2850,难吃的一批，作为四川人，我从来没吃过这么难吃的面，口味问题吗,NULL;,难吃;,-1;
2851,别说摸着用着感觉质量不错，看看能用多久吧,质量;,不错;,1;
